{
  "schema_version": "1.0.0",
  "registry_version": "1.0.0",
  "role_id": "evidence-truth-guardian",
  "subject": "commit:0123456789abcdef0123456789abcdef01234567",
  "evidence_subject": "commit:0123456789abcdef0123456789abcdef01234567",
  "claim": "The evidence postdates the subject.",
  "evidence_level": "E3",
  "truth_label": "REPRODUCED",
  "producer": "test-authenticity-guardian",
  "observed_at": "2026-07-28T00:00:00Z",
  "subject_changed_at": "2026-07-29T00:00:00Z",
  "gaps": []
}
